{"antecedent":"(adult patient) AND (dx sepsis)","certificate_ids":[],"consequent":"(administer beta_lactam)","context":"adult_patient AND sepsis","exceptions":["a_exception","z_exception"],"kind":"defeasible","norm":{"action":{"action_type":"administer","parameters":{"route":"iv"},"quantity_constraints":{"volume":{"unit":"mL","value":500}},"target_concept":"concept_beta_lactam","temporal_constraints":{"onset":"immediate"}},"context":"sepsis in adult patients","deontic_projection":"recommended","direction":"for","evidence_certainty":"moderate","exception_policy":"beta-lactam allergy contraindicates","original_modality_phrase_ja":"投与を推奨する","prima_facie_or_all_things_considered":"prima_facie","recommendation_strength":"strong"},"population_scope":"adult","priority_over":[],"profiles":["CKC-Norm","CKC-Defeasible"],"provenance":"guideline_sepsis_2024_cq1","rule_id":"nf-ce3ecd6c06de5f988fc1ba2b4bf6dd5c","source_span_ids":["span_s1","span_s2"],"temporal_scope":"acute_phase"}