[{"antecedent":"(dx sepsis) AND (adult patient)","certificate_ids":[],"consequent":"(administer beta_lactam)","context":"(dx sepsis) AND (adult patient)","exceptions":["beta_lactam_anaphylaxis"],"kind":"defeasible","norm":{"action":{"action_type":"administer","parameters":{"dose_range":"standard","route":"iv"},"quantity_constraints":{"min_dose_mg":1000},"target_concept":"concept_beta_lactam","temporal_constraints":{"onset":"immediate"}},"context":"adult sepsis","deontic_projection":"recommended","direction":"for","evidence_certainty":"moderate","exception_policy":"beta-lactam allergy contraindicates","original_modality_phrase_ja":"投与を推奨する","prima_facie_or_all_things_considered":"prima_facie","recommendation_strength":"strong"},"population_scope":"adult","priority_over":[],"profiles":["CKC-Norm","CKC-Defeasible"],"provenance":"JSICM sepsis guideline 2024, CQ1","rule_id":"rule_sepsis_bl_recommend","source_span_ids":["span_rec_sepsis_bl","span_evidence_sepsis"],"temporal_scope":"acute_phase"},{"antecedent":"(allergy_history beta_lactam anaphylaxis)","certificate_ids":[],"consequent":"(contraindicate beta_lactam)","context":"(allergy_history beta_lactam anaphylaxis) AND (patient)","exceptions":[],"kind":"defeasible","norm":{"action":{"action_type":"administer","parameters":{"dose_range":"any","route":"any"},"quantity_constraints":{},"target_concept":"concept_beta_lactam","temporal_constraints":{}},"context":"beta-lactam anaphylaxis history","deontic_projection":"prohibited","direction":"against","evidence_certainty":"high","exception_policy":"absolute contraindication","original_modality_phrase_ja":"禁忌である","prima_facie_or_all_things_considered":"all_things_considered","recommendation_strength":"strong"},"priority_over":["rule_sepsis_bl_recommend"],"profiles":["CKC-Norm","CKC-Defeasible"],"provenance":"JSA drug allergy manual ed.3, contraindication section","rule_id":"rule_bl_anaphylaxis_contra","source_span_ids":["span_contra_bl_allergy","span_allergy_history"]},{"antecedent":"(dx sepsis) AND (adult patient)","certificate_ids":[],"consequent":"(monitor vital_signs)","context":"(dx sepsis)","exceptions":[],"kind":"strict","priority_over":[],"profiles":["CKC-Norm"],"provenance":"","rule_id":"rule_incomplete_provenance","source_span_ids":[]}]