{"antecedent":"(dx sepsis) AND (adult patient)","certificate_ids":[],"consequent":"(administer beta_lactam)","context":"sepsis AND adult","exceptions":["beta_lactam_allergy"],"kind":"defeasible","norm":{"action":{"action_type":"administer","parameters":{"route":"iv"},"quantity_constraints":{"min_dose_mg":1000},"target_concept":"concept_beta_lactam","temporal_constraints":{"onset":"immediate"}},"context":"sepsis in adult patients","deontic_projection":"recommended","direction":"for","evidence_certainty":"moderate","exception_policy":"beta-lactam allergy contraindicates","original_modality_phrase_ja":"投与を推奨する","prima_facie_or_all_things_considered":"prima_facie","recommendation_strength":"strong"},"priority_over":[],"profiles":["CKC-Norm","CKC-Defeasible"],"provenance":"guideline_sepsis_2024_cq1","rule_id":"rule_sepsis_bl_001","source_span_ids":["span_gl_s1"],"temporal_scope":"acute_phase"}